{
  "_spdx": "GPL-3.0-only",
  "schema": 1,
  "schema_definition": {
    "relative_path": "vkd3d-shader-toolchain-lock.schema.json",
    "sha256": "8cd4361a09adc07ab35ada394743db2580ffbd0ae62458cdd601679a6ca34814"
  },
  "name": "vkd3d-shader-host-tools-20260722",
  "status": "ready",
  "reason": "Exact installed host-tool and cached-package identities are locked for read-only source-generation, proof-only no-LTO twin-compilation, and object-validation evidence. Upstream may enable -flto=auto for a later production link, but this closure pins -fno-lto because linking is not authorized and LTO objects did not reproduce across owned roots. The lock does not authorize fetching, downloading, installation, production linking, staging, activation, guest execution, or graphics capability advertisement.",
  "roots": [
    {
      "id": "msys",
      "purpose": "MSYS Flex, Bison, M4, data, and runtime closure",
      "required_live": true
    },
    {
      "id": "ucrt64",
      "purpose": "UCRT64 WIDL, GCC, assembler, objdump, and runtime closure",
      "required_live": true
    },
    {
      "id": "git",
      "purpose": "Git for Windows Perl and JSON module closure",
      "required_live": true
    },
    {
      "id": "package_cache",
      "purpose": "Read-only cached MSYS2 package archives",
      "required_live": true
    }
  ],
  "packages": [
    {
      "root": "msys",
      "name": "bison",
      "version": "3.8.2-5",
      "architecture": "x86_64",
      "archive": {
        "present": true,
        "relative_path": "bison-3.8.2-5-x86_64.pkg.tar.zst",
        "bytes": 795844,
        "sha256": "7439ca784a9909e0730a513d3aff15852c3b292ac85053fa2dd7a2a19c1ce04c"
      }
    },
    {
      "root": "msys",
      "name": "flex",
      "version": "2.6.4-4",
      "architecture": "x86_64",
      "archive": {
        "present": true,
        "relative_path": "flex-2.6.4-4-x86_64.pkg.tar.zst",
        "bytes": 310795,
        "sha256": "d70fbf25d0dea3cb8ae42670b79a8ba65a48daa140137367b5ebaf37eb48df26"
      }
    },
    {
      "root": "msys",
      "name": "m4",
      "version": "1.4.19-2",
      "architecture": "x86_64",
      "archive": {
        "present": true,
        "relative_path": "m4-1.4.19-2-x86_64.pkg.tar.zst",
        "bytes": 243775,
        "sha256": "4a1d296571afa7b8837fd5e227e16c9cb7e26c0f31f03b364e11c1ae8ee2a913"
      }
    },
    {
      "root": "msys",
      "name": "msys2-runtime",
      "version": "3.6.5-1",
      "architecture": "x86_64",
      "archive": {"present": false, "relative_path": "", "bytes": 0, "sha256": ""}
    },
    {
      "root": "msys",
      "name": "libiconv",
      "version": "1.18-1",
      "architecture": "x86_64",
      "archive": {"present": false, "relative_path": "", "bytes": 0, "sha256": ""}
    },
    {
      "root": "msys",
      "name": "libintl",
      "version": "0.22.5-1",
      "architecture": "x86_64",
      "archive": {"present": false, "relative_path": "", "bytes": 0, "sha256": ""}
    },
    {
      "root": "ucrt64",
      "name": "mingw-w64-ucrt-x86_64-binutils",
      "version": "2.45.1-1",
      "architecture": "any",
      "archive": {
        "present": true,
        "relative_path": "mingw-w64-ucrt-x86_64-binutils-2.45.1-1-any.pkg.tar.zst",
        "bytes": 6528822,
        "sha256": "86400934ff2c2f2bc1191d0545d827116098aaefe5722271ac3f41eea59c3503"
      }
    },
    {
      "root": "ucrt64",
      "name": "mingw-w64-ucrt-x86_64-gcc",
      "version": "15.2.0-8",
      "architecture": "any",
      "archive": {
        "present": true,
        "relative_path": "mingw-w64-ucrt-x86_64-gcc-15.2.0-8-any.pkg.tar.zst",
        "bytes": 48902346,
        "sha256": "96f3e0ffb2863f47f7471af7b57a4d4b1a7f823c85a5eea36dd1e03c6e8fc6f0"
      }
    },
    {
      "root": "ucrt64",
      "name": "mingw-w64-ucrt-x86_64-gcc-libs",
      "version": "15.2.0-8",
      "architecture": "any",
      "archive": {
        "present": true,
        "relative_path": "mingw-w64-ucrt-x86_64-gcc-libs-15.2.0-8-any.pkg.tar.zst",
        "bytes": 1075333,
        "sha256": "7e660afc9c49d7b55aec94c289564a2b32240c41a7937cbe77912320bdf63458"
      }
    },
    {
      "root": "ucrt64",
      "name": "mingw-w64-ucrt-x86_64-gmp",
      "version": "6.3.0-2",
      "architecture": "any",
      "archive": {
        "present": true,
        "relative_path": "mingw-w64-ucrt-x86_64-gmp-6.3.0-2-any.pkg.tar.zst",
        "bytes": 592359,
        "sha256": "e82a75968a556484a50084578238a84eb60fb93e34986fd6695c537975bd39ea"
      }
    },
    {
      "root": "ucrt64",
      "name": "mingw-w64-ucrt-x86_64-isl",
      "version": "0.27-1",
      "architecture": "any",
      "archive": {
        "present": true,
        "relative_path": "mingw-w64-ucrt-x86_64-isl-0.27-1-any.pkg.tar.zst",
        "bytes": 1488361,
        "sha256": "f23edcbe1206429e6fdb5f1dfc3053cf08c0d5bd1d8135a948a75146d65ce394"
      }
    },
    {
      "root": "ucrt64",
      "name": "mingw-w64-ucrt-x86_64-mpc",
      "version": "1.3.1-2",
      "architecture": "any",
      "archive": {
        "present": true,
        "relative_path": "mingw-w64-ucrt-x86_64-mpc-1.3.1-2-any.pkg.tar.zst",
        "bytes": 131402,
        "sha256": "3a464e20548ad82f18000cba25060e71ab852458d61e0546a5cd8804e9b322e5"
      }
    },
    {
      "root": "ucrt64",
      "name": "mingw-w64-ucrt-x86_64-mpfr",
      "version": "4.2.2-1",
      "architecture": "any",
      "archive": {
        "present": true,
        "relative_path": "mingw-w64-ucrt-x86_64-mpfr-4.2.2-1-any.pkg.tar.zst",
        "bytes": 554920,
        "sha256": "4cd9f334abed608e2b6c90151a20ee6645ed0a8f9b1fd5a57b0244df2af63a0f"
      }
    },
    {
      "root": "ucrt64",
      "name": "mingw-w64-ucrt-x86_64-tools-git",
      "version": "13.0.0.r354.g40ab95d18-1",
      "architecture": "any",
      "archive": {
        "present": true,
        "relative_path": "mingw-w64-ucrt-x86_64-tools-git-13.0.0.r354.g40ab95d18-1-any.pkg.tar.zst",
        "bytes": 349098,
        "sha256": "8a118787779fed5de109256b31103ad814553d09441692e3cff4b851035a79a1"
      }
    },
    {
      "root": "ucrt64",
      "name": "mingw-w64-ucrt-x86_64-libwinpthread",
      "version": "13.0.0.r354.g40ab95d18-1",
      "architecture": "any",
      "archive": {
        "present": true,
        "relative_path": "mingw-w64-ucrt-x86_64-libwinpthread-13.0.0.r354.g40ab95d18-1-any.pkg.tar.zst",
        "bytes": 30326,
        "sha256": "9eb2a1b21f787580c87140695ee205348967e6ac71228517cc6c3daf00e80c5a"
      }
    },
    {
      "root": "ucrt64",
      "name": "mingw-w64-ucrt-x86_64-zlib",
      "version": "1.3.1-1",
      "architecture": "any",
      "archive": {
        "present": true,
        "relative_path": "mingw-w64-ucrt-x86_64-zlib-1.3.1-1-any.pkg.tar.zst",
        "bytes": 94303,
        "sha256": "b0288e983af4d3f949976f4f226249eb20119f7b1bfd3d1beee943b2baca28fb"
      }
    },
    {
      "root": "ucrt64",
      "name": "mingw-w64-ucrt-x86_64-zstd",
      "version": "1.5.7-1",
      "architecture": "any",
      "archive": {
        "present": true,
        "relative_path": "mingw-w64-ucrt-x86_64-zstd-1.5.7-1-any.pkg.tar.zst",
        "bytes": 657742,
        "sha256": "a05acb75b5f31d1dc27727662c6b60e6cd822fbb1b74261610ff3011de6fadc8"
      }
    },
    {
      "root": "ucrt64",
      "name": "mingw-w64-ucrt-x86_64-gettext-runtime",
      "version": "0.26-2",
      "architecture": "any",
      "archive": {
        "present": true,
        "relative_path": "mingw-w64-ucrt-x86_64-gettext-runtime-0.26-2-any.pkg.tar.zst",
        "bytes": 413608,
        "sha256": "6de37d5293f0e6565545a7b1a3c91af12a3ab55942de2eacadc3d12d05a5c06c"
      }
    },
    {
      "root": "ucrt64",
      "name": "mingw-w64-ucrt-x86_64-libiconv",
      "version": "1.18-1",
      "architecture": "any",
      "archive": {
        "present": true,
        "relative_path": "mingw-w64-ucrt-x86_64-libiconv-1.18-1-any.pkg.tar.zst",
        "bytes": 742765,
        "sha256": "6b875c9ea05969cd4d802c1fc68edd158c269447e8dbf1baee02dec28603e74c"
      }
    },
    {
      "root": "git",
      "name": "git-for-windows",
      "version": "2.54.0.windows.1",
      "architecture": "x86_64",
      "archive": {"present": false, "relative_path": "", "bytes": 0, "sha256": ""}
    },
    {
      "root": "git",
      "name": "mingw-w64-x86_64-gettext-runtime",
      "version": "1.0-1",
      "architecture": "x86_64",
      "archive": {"present": false, "relative_path": "", "bytes": 0, "sha256": ""}
    },
    {
      "root": "git",
      "name": "mingw-w64-x86_64-libiconv",
      "version": "1.19-1",
      "architecture": "x86_64",
      "archive": {"present": false, "relative_path": "", "bytes": 0, "sha256": ""}
    },
    {
      "root": "git",
      "name": "mingw-w64-x86_64-libwinpthread",
      "version": "14.0.0.r14.g4761eabdd-1",
      "architecture": "x86_64",
      "archive": {"present": false, "relative_path": "", "bytes": 0, "sha256": ""}
    },
    {
      "root": "git",
      "name": "mingw-w64-x86_64-pcre2",
      "version": "10.47-1",
      "architecture": "x86_64",
      "archive": {"present": false, "relative_path": "", "bytes": 0, "sha256": ""}
    },
    {
      "root": "git",
      "name": "mingw-w64-x86_64-zlib",
      "version": "1.3.2-2",
      "architecture": "x86_64",
      "archive": {"present": false, "relative_path": "", "bytes": 0, "sha256": ""}
    },
    {
      "root": "git",
      "name": "perl",
      "version": "5.42.2-1",
      "architecture": "x86_64",
      "archive": {"present": false, "relative_path": "", "bytes": 0, "sha256": ""}
    },
    {
      "root": "git",
      "name": "perl-JSON",
      "version": "4.11-1",
      "architecture": "x86_64",
      "archive": {"present": false, "relative_path": "", "bytes": 0, "sha256": ""}
    },
    {
      "root": "git",
      "name": "msys2-runtime",
      "version": "3.6.7-4",
      "architecture": "x86_64",